No,Category,Issue,Keywords,Platform,Description,Do,Don't,Code Example Good,Code Example Bad,Severity
1,Accessibility,Icon Button Labels,icon button aria-label,Web,Icon-only buttons must have accessible names,Add aria-label to icon buttons,Icon button without label,"<button aria-label='Close'><XIcon /></button>","<button><XIcon /></button>",Critical
2,Accessibility,Form Control Labels,form input label aria,Web,All form controls need labels or aria-label,Use label element or aria-label,Input without accessible name,"<label for='email'>Email</label><input id='email' />","<input placeholder='Email' />",Critical
3,Accessibility,Keyboard Handlers,keyboard onclick onkeydown,Web,Interactive elements must support keyboard interaction,Add onKeyDown alongside onClick,Click-only interaction,"<div onClick={fn} onKeyDown={fn} tabIndex={0}>","<div onClick={fn}>",High
4,Accessibility,Semantic HTML,semantic button a label,Web,Use semantic HTML before ARIA attributes,Use button/a/label elements,Div with role attribute,"<button onClick={fn}>Submit</button>","<div role='button' onClick={fn}>Submit</div>",High
5,Accessibility,Aria Live,aria-live polite async,Web,Async updates need aria-live for screen readers,Add aria-live='polite' for dynamic content,Silent async updates,"<div aria-live='polite'>{status}</div>","<div>{status}</div> // no announcement",Medium
6,Accessibility,Decorative Icons,aria-hidden decorative icon,Web,Decorative icons should be hidden from screen readers,Add aria-hidden='true' to decorative icons,Decorative icon announced,"<Icon aria-hidden='true' />","<Icon /> // announced as 'image'",Medium
7,Focus,Visible Focus States,focus-visible outline ring,Web,All interactive elements need visible focus states,Use :focus-visible with ring/outline,No focus indication,"focus-visible:ring-2 focus-visible:ring-blue-500","outline-none // no replacement",Critical
8,Focus,Never Remove Outline,outline-none focus replacement,Web,Never remove outline without providing replacement,Replace outline with visible alternative,Remove outline completely,"focus:outline-none focus:ring-2","focus:outline-none // nothing else",Critical
9,Focus,Checkbox Radio Hit Target,checkbox radio label target,Web,Checkbox/radio must share hit target with label,Wrap input and label together,Separate tiny checkbox,"<label class='flex gap-2'><input type='checkbox' /><span>Option</span></label>","<input type='checkbox' id='x' /><label for='x'>Option</label>",Medium
10,Forms,Autocomplete Attribute,autocomplete input form,Web,Inputs need autocomplete attribute for autofill,Add appropriate autocomplete value,Missing autocomplete,"<input autocomplete='email' type='email' />","<input type='email' />",High
11,Forms,Semantic Input Types,input type email tel url,Web,Use semantic input type attributes,Use email/tel/url/number types,text type for everything,"<input type='email' />","<input type='text' /> // for email",Medium
12,Forms,Never Block Paste,paste onpaste password,Web,Never prevent paste functionality,Allow paste on all inputs,Block paste on password/code,"<input type='password' />","<input onPaste={e => e.preventDefault()} />",High
13,Forms,Spellcheck Disable,spellcheck email code,Web,Disable spellcheck on emails and codes,Set spellcheck='false' on codes,Spellcheck on technical input,"<input spellCheck='false' type='email' />","<input type='email' /> // red squiggles",Low
14,Forms,Submit Button Enabled,submit button disabled loading,Web,Keep submit enabled and show spinner during requests,Show loading spinner keep enabled,Disable button during submit,"<button>{loading ? <Spinner /> : 'Submit'}</button>","<button disabled={loading}>Submit</button>",Medium
15,Forms,Inline Errors,error message inline focus,Web,Show error messages inline near the problem field,Inline error with focus on first error,Single error at top,"<input /><span class='text-red-500'>{error}</span>","<div class='error'>{allErrors}</div> // at top",High
16,Performance,Virtualize Lists,virtualize list 50 items,Web,Virtualize lists exceeding 50 items,Use virtual list for large datasets,Render all items,"<VirtualList items={items} />","items.map(item => <Item />)",High
17,Performance,Avoid Layout Reads,layout read render getboundingclientrect,Web,Avoid layout reads during render phase,Read layout in effects or callbacks,getBoundingClientRect in render,"useEffect(() => { el.getBoundingClientRect() })","const rect = el.getBoundingClientRect() // in render",Medium
18,Performance,Batch DOM Operations,batch dom write read,Web,Group DOM operations to minimize reflows,Batch writes then reads,Interleave reads and writes,"writes.forEach(w => w()); reads.forEach(r => r())","write(); read(); write(); read(); // thrashing",Medium
19,Performance,Preconnect CDN,preconnect link cdn,Web,Add preconnect links for CDN domains,Preconnect to known domains,"<link rel='preconnect' href='https://cdn.example.com' />","// no preconnect hint",Low
20,Performance,Lazy Load Images,lazy loading image below-fold,Web,Lazy-load images below the fold,Use loading='lazy' for below-fold images,Load all images eagerly,"<img loading='lazy' src='...' />","<img src='...' /> // above fold only",Medium
21,State,URL Reflects State,url state query params,Web,URL should reflect current UI state,Sync filters/tabs/pagination to URL,State only in memory,"?tab=settings&page=2","useState only // lost on refresh",High
22,State,Deep Linking,deep link stateful component,Web,Stateful components should support deep-linking,Enable sharing current view via URL,No shareable state,"router.push({ query: { ...filters } })","setFilters(f) // not in URL",Medium
23,State,Confirm Destructive Actions,confirm destructive delete modal,Web,Destructive actions require confirmation,Show confirmation dialog before delete,Delete without confirmation,"if (confirm('Delete?')) delete()","onClick={delete} // no confirmation",High
24,Typography,Proper Unicode,unicode ellipsis quotes,Web,Use proper Unicode characters,Use ... curly quotes proper dashes,ASCII approximations,"'Hello...' with proper ellipsis","'Hello...' with three dots",Low
25,Typography,Text Overflow,truncate line-clamp overflow,Web,Handle text overflow properly,Use truncate/line-clamp/break-words,Text overflows container,"<p class='truncate'>Long text...</p>","<p>Long text...</p> // overflows",Medium
26,Typography,Non-Breaking Spaces,nbsp unit brand,Web,Use non-breaking spaces for units and brand names,Use &nbsp; between number and unit,"10&nbsp;kg or Next.js&nbsp;14","10 kg // may wrap",Low
27,Anti-Pattern,No Zoom Disable,viewport zoom disable,Web,Never disable zoom in viewport meta,Allow user zoom,"<meta name='viewport' content='width=device-width'>","<meta name='viewport' content='maximum-scale=1'>",Critical
28,Anti-Pattern,No Transition All,transition all specific,Web,Avoid transition: all - specify properties,Transition specific properties,transition: all,"transition-colors duration-200","transition-all duration-200",Medium
29,Anti-Pattern,Outline Replacement,outline-none ring focus,Web,Never use outline-none without replacement,Provide visible focus replacement,Remove outline with nothing,"focus:outline-none focus:ring-2 focus:ring-blue-500","focus:outline-none // alone",Critical
30,Anti-Pattern,No Hardcoded Dates,date format intl locale,Web,Use Intl for date/number formatting,Use Intl.DateTimeFormat,Hardcoded date format,"new Intl.DateTimeFormat('en').format(date)","date.toLocaleDateString() // or manual format",Medium
31,AI Interaction,Streaming Response,streaming ai typewriter sse,Web,AI responses should stream progressively not appear all at once,Use SSE/WebSocket with progressive text reveal and cursor indicator,Wait for complete response then show all at once,"<div aria-live='polite'>{streamedText}<span class='cursor blink' /></div>","<div>{loading ? <Spinner /> : response}</div>",High
32,AI Interaction,Thinking Indicator,ai thinking loading skeleton,Web,Show distinct thinking state when AI is processing with animated indicator,Use pulsing dots or skeleton with aria-busy='true',Use generic spinner without context,"<div aria-busy='true' class='thinking'><span class='dot-pulse' /> Thinking...</div>","<Spinner /> // no context",High
33,AI Interaction,Citation Source Links,citation source reference ai,Web,AI-generated content should include verifiable source citations,Link citations inline with hover preview and source indicator,"No sources or unverifiable claims","<sup><a href='#ref1' class='citation'>[1]</a></sup>","<p>AI says this is true.</p> // no source",Medium
34,AI Interaction,Regenerate Action,regenerate retry ai response,Web,Provide clear regenerate/retry option for AI responses,Show regenerate button with different prompt option,No way to get alternative response,"<button aria-label='Regenerate response'><RefreshCw /> Regenerate</button>","// no regenerate option",Medium
35,AI Interaction,Copy Code Block,copy code ai clipboard,Web,AI code outputs need one-click copy with feedback,Add copy button with checkmark confirmation on code blocks,No copy button on code output,"<button onClick={copy}>{copied ? <Check /> : <Copy />}</button>","// manual text selection only",High
36,Skeleton Loading,Content Skeleton,skeleton placeholder loading shimmer,Web,Show skeleton screens instead of spinners for layout-stable loading,Use skeleton matching final layout shape with shimmer animation,Use spinner that causes layout shift,"<div class='skeleton' style='width:100%;height:200px' />","<Spinner /> // then content shifts in",High
37,Skeleton Loading,Skeleton Sizing,skeleton width height ratio,Web,Skeleton elements must match the actual content dimensions,Match skeleton to real content height/width/aspect-ratio,Generic rectangle that doesn't match,"<div class='skeleton w-full h-[48px] rounded-md' />","<div class='skeleton w-20 h-10' /> // wrong size",Medium
38,Skeleton Loading,Skeleton Accessibility,skeleton aria-busy label,Web,Skeleton loading states need proper ARIA attributes,Use aria-busy='true' and aria-label on skeleton containers,Skeleton with no accessibility info,"<div aria-busy='true' aria-label='Loading content'><Skeleton /></div>","<Skeleton /> // no aria",Medium
39,Toast Notification,Toast Duration,toast auto-dismiss timer,Web,Toast notifications need appropriate auto-dismiss timing by severity,Info: 3-5s auto-dismiss; Error: manual dismiss; Success: 3s,Same duration for all types or no auto-dismiss,"toast({ message: 'Saved', duration: 3000 })","toast('Saved') // no dismiss or 30s",Medium
40,Toast Notification,Toast Stacking,toast stack limit queue,Web,Limit visible toasts and queue excess ones,Max 3-5 visible toasts with queue; newest on top or bottom consistent,Unlimited stacking that covers UI,"<Toaster limit={3} position='top-right' />","// unlimited toasts covering page",Medium
41,Toast Notification,Toast Action Button,toast undo action cta,Web,Destructive action toasts should include undo/action button,Include undo CTA on delete/destructive toasts with countdown,Delete confirmation with no undo,"toast({ message: 'Deleted', action: { label: 'Undo', onClick: undo } })","toast('Deleted') // no undo option",High
42,Toast Notification,Toast ARIA,toast aria-live role alert,Web,Toast notifications must use proper ARIA live regions,Use role='alert' for errors and aria-live='polite' for info,No ARIA on toast container,"<div role='alert' aria-live='assertive'>{errorToast}</div>","<div class='toast'>{message}</div> // no ARIA",Critical
43,Dark Mode,Color Scheme Meta,color-scheme meta dark,Web,Declare supported color schemes in meta tag and CSS,Add color-scheme: dark light in CSS and meta tag,Only toggle class without declaring scheme,"<meta name='color-scheme' content='light dark'>","// no color-scheme declaration",Medium
44,Dark Mode,Prefers Color Scheme,prefers-color-scheme media query,Web,Respect OS-level dark mode preference as default,Use prefers-color-scheme media query for initial state,Ignore system preference entirely,"@media (prefers-color-scheme: dark) { :root { --bg: #0f172a } }","// hardcoded light theme only",High
45,Dark Mode,Dark Mode Images,dark mode image filter invert,Web,Adjust images and illustrations for dark mode backgrounds,Provide dark variants or use CSS filter for appropriate contrast,Same bright images on dark background,"<picture><source srcset='logo-dark.svg' media='(prefers-color-scheme:dark)'><img src='logo.svg'></picture>","<img src='logo.svg' /> // bright on dark bg",Medium
46,Responsive,Container Queries,container query component,Web,Use container queries for component-level responsive design,Use @container for component sizing independent of viewport,Only viewport-based media queries,"@container (min-width: 400px) { .card { grid-template-columns: 1fr 1fr } }","@media (min-width: 768px) // for component sizing",Low
47,Responsive,Touch Target Size,touch target 44px minimum,Web,Interactive elements need minimum 44x44px touch targets on mobile,Ensure all buttons/links have min 44px touch target with padding,Tiny touch targets on mobile,"<button class='min-h-[44px] min-w-[44px] p-3'>","<button class='p-1 text-xs'> // too small",Critical
48,Responsive,Scroll Snap,scroll-snap carousel mobile,Web,Use scroll-snap for horizontal carousels on touch devices,Implement scroll-snap-type and scroll-snap-align for smooth stops,JavaScript-based carousel without snap,"<div style='scroll-snap-type:x mandatory;overflow-x:auto'>","<div onScroll={handleSnap}> // JS-based",Medium
49,Content,Empty State Design,empty state zero data placeholder,Web,Empty states need helpful illustration and clear CTA for next action,Show contextual message with illustration and primary action CTA,Blank page or generic 'No data' text,"<EmptyState icon={<Inbox />} title='No messages' action='Compose' />","<p>No data</p> // unhelpful",High
50,Content,Loading Error Recovery,error retry fallback boundary,Web,Failed content loads need clear error state with retry action,Show error message with retry button and fallback content option,Silent failure or cryptic error,"<ErrorBoundary fallback={<RetryPanel onRetry={refetch} />}>","// catch silently or show stack trace",High
